{"budget":{"bytes":20000000000,"cost_units":10000,"human_reviews":500,"model_tokens":0,"source_calls":100000},"completion":{"acceptable_unknowns":["evidence_missing","human_judgment_required","key_family_uncovered"],"allow_operational_unknowns":false,"require_every_subject_accounted":true},"identity_target":{"allow_new_key_families":false,"anchor_families":["figi","lei"],"entity_grains":["instrument"],"key_families":["cusip","isin"],"optimization":"maximal_admissible_closure","temporal":"track_identifier_succession"},"lenses":{"policy":"promotion:instrument-identity-v0@blake3:3333333333333333333333333333333333333333333333333333333333333333","profile":"canon:entity-profile:instrument_identity@blake3:1111111111111111111111111111111111111111111111111111111111111111","registry":"blake3:2222222222222222222222222222222222222222222222222222222222222222"},"output":{"disclosure":"public","kind":"time_series_safe_instrument_key"},"question":{"as_of":{"from":"2019-09-30","to":"2026-07-31"},"predicate":"identifies_same_instrument_closure","subject":"snowflake://edgar_db.dbt_wrangling_edgar/nport_holdings_authoritative"},"requested_authority":{"connectors":[{"operations":["describe_table","fetch_result","run_query"],"provider":"cmdrvl-data-mcp"},{"operations":["read"],"provider":"openfigi"}],"model_context":"metadata_only","mutations":["registry_promotion:instrument_identity"]},"schema":"inquiry.v0","source_policy":{"classes_allowed":["external_anchor_api","landed_public"],"disclosure_ceiling":"public"},"universe":{"grain":"instrument_observation","placeholder_identifiers":["","000000000","N/A","NA"],"rule":"distinct_identifier_tuple_per_period"}}
